{
    "$schema": "http://json-schema.org/draft-06/schema",
    "type": "object",
    "properties": {
        "_id": {
            "$ref": "./definitions/id-def.json"
        },
        "name": {
            "$ref": "./definitions/name-def.json"
        },
        "label": {
            "$ref": "./definitions/label-def.json"
        },
        "properties": {
            "type": "array",
            "items": {
                "minItems": 1,
                "$ref": "property-schema.json"
            }
        }
    },
    "required": [
        "_id",
        "name",
        "properties"
    ]
}