{
    "_id": "entity_ref",
    "name": "entity_ref",
    "label": "Ref",
    "properties": [
        {
            "name": "entity",
            "label": "Entity",
            "type": "linkedEntity",
            "ref": {
                "entity": {
                    "id": "entity_type",
                    "label": "Entity Type"
                }
            }
        }
    ]
}